{"$schema":"https://json-schema.org/draft/2020-12/schema","$id":"https://cps.local/schemas/connected_executor_manifest.schema.json","title":"ConnectedExecutorManifest v1","type":"object","additionalProperties":false,"required":["schema","schema_version","pipeline_order","canonical_json_contract","contract_hashes","schema_hashes"],"properties":{"schema":{"const":"cps.connected-executor-manifest"},"schema_version":{"const":"1.0.0"},"pipeline_order":{"const":"mutation-then-gen0b-compile-then-melody/v1"},"canonical_json_contract":{"const":"cps-canonical-json/v1"},"contract_hashes":{"$ref":"#/$defs/contracts"},"schema_hashes":{"$ref":"#/$defs/schemas"}},"$defs":{"sha256":{"type":"string","pattern":"^sha256:[0-9a-f]{64}$"},"contracts":{"type":"object","additionalProperties":false,"required":["mutation_application","gen0b_compiler_lowering","chord_member_melody","connected_execution"],"properties":{"mutation_application":{"$ref":"#/$defs/sha256"},"gen0b_compiler_lowering":{"$ref":"#/$defs/sha256"},"chord_member_melody":{"$ref":"#/$defs/sha256"},"connected_execution":{"$ref":"#/$defs/sha256"}}},"schemas":{"type":"object","additionalProperties":false,"required":["song_program","mutation","mutation_request","mutation_impact","mutation_receipt","compiler_manifest","project","gen0b_evidence","melody_report","compile_report","charge_receipt","opcode_stream","opcode_bundle","connected_request","connected_output","connected_cache_entry"],"properties":{"song_program":{"$ref":"#/$defs/sha256"},"mutation":{"$ref":"#/$defs/sha256"},"mutation_request":{"$ref":"#/$defs/sha256"},"mutation_impact":{"$ref":"#/$defs/sha256"},"mutation_receipt":{"$ref":"#/$defs/sha256"},"compiler_manifest":{"$ref":"#/$defs/sha256"},"project":{"$ref":"#/$defs/sha256"},"gen0b_evidence":{"$ref":"#/$defs/sha256"},"melody_report":{"$ref":"#/$defs/sha256"},"compile_report":{"$ref":"#/$defs/sha256"},"charge_receipt":{"$ref":"#/$defs/sha256"},"opcode_stream":{"$ref":"#/$defs/sha256"},"opcode_bundle":{"$ref":"#/$defs/sha256"},"connected_request":{"$ref":"#/$defs/sha256"},"connected_output":{"$ref":"#/$defs/sha256"},"connected_cache_entry":{"$ref":"#/$defs/sha256"}}}}}
