{"canonical_json_contract":"cps-canonical-json/v1","contract_hashes":{"chord_member_melody":"sha256:bdf363ab861a3199e7f592ddd241928d0ab0263324fde1b7f5147be854d122ab","connected_execution":"sha256:9413f380cfb7d50b8453f05bcd65161baca9112d5b31027fda54c2c2bf9bc2c7","gen0b_compiler_lowering":"sha256:40e2935df42f6d4af8c83542b63fcbad3f58ffd382263e0b1650de5f53dbe543","mutation_application":"sha256:ebdff40b0ca1b1ae51710f8e322de81f6498e1ab79da70a12c973275c7023f8c"},"pipeline_order":"mutation-then-gen0b-compile-then-melody/v1","schema":"cps.connected-executor-manifest","schema_hashes":{"charge_receipt":"sha256:265df8da75dde59bb3b745805c0ae18040a9a0554969512222f6c14611b0fb7b","compile_report":"sha256:76aaba56da4739b30ec7f4efab4e0dc31329daeeb184e15503b0a39d73f9c526","compiler_manifest":"sha256:03bced9e4203dbb1a7832cf8a66f8cf32e5241314f89c5b0c4784682dc408601","connected_cache_entry":"sha256:147d22d70e2d835daa03e4f7f4fdf87ac38fb657cba651cc7c4fe9b6d0c6b117","connected_output":"sha256:30975fa19ada3d84cea9caa8be04f7b62ec95e4d68431a9c414908803e47cd11","connected_request":"sha256:290610deff4aa74fcee9cf3cfb09cffaba05ff049b5c8123e32f7f28652ce225","gen0b_evidence":"sha256:3e9f0750c433ee86c70fce7fdce5cfdc43bb403e8992916fef66f2258c7856bf","melody_report":"sha256:db16e853d955b31bce5b666b8431c03dc2b5ccd1d519b5fc588ba5479d5ae930","mutation":"sha256:10802fc0679c7b4bbf5f8a9108c0eccdc94981f2b0befd677252a8c54c9755ef","mutation_impact":"sha256:5818bce2f320dee567ed7f149cfd1249041d12bd7597ba6e8b1844735d1309fd","mutation_receipt":"sha256:c0c6b12117ab3a2d7c224aafec45c7b47a2e60ca38a76d8c4439eb985438a96a","mutation_request":"sha256:8e654cd7b6abc6f7466eaeaa8a96c0e5c137c8705a24a07a43a0e299b790b354","opcode_bundle":"sha256:03a15ba8adcd6b23607b9a613b43f431bc31841af9adbf9e24cd271154db5a90","opcode_stream":"sha256:646ee4fe3e900bebad9fafe500919b65223a1405da897a4ee203a0af34c8178b","project":"sha256:960891e2390acb2a3c14e35074de9a56bb0604c9098baff0aada3fbeeeeb167d","song_program":"sha256:5b25102d8fe42355293359d3ac4646d132ed5f829083d82db375d0af9b53cded"},"schema_version":"1.0.0"}